### ISSUE TITLE
Live stream [ARD] does not work

### ISSUE THREAD

**Issue by jw243** [mediathekview/zapp#470]
## Which channel does not work correctly?
ARD

## What is the problem?
- [ ] does not load at all
- [ ] shows always the same looping content
- [ ] performance problem (stuttering or other)
- [x] other problem (add description)

On my tablet, the ARD stream does not work at all anymore, on my phone, it stops several times during a broadcast.

**Comment by DaleBCooper** [comment]
Seems like a TLS issue. When the error occurs this shows up in logcat:

12-20 22:08:27.789 19644 19644 E v       : error:10000438:SSL routines:OPENSSL_internal:TLSV1_ALERT_INTERNAL_ERROR (external/boringssl/src/ssl/tls_record.cc:592 0xb400007915e98920:0x00000003)

It does not happen all the time, sometimes the stream works. So I guess there are several ARD servers and they have different SSL configurations.

**Comment by DaleBCooper** [comment]
Looks like  I've found it while sniffing the DNS traffic. 

For ARD live stream Zapp uses the domain mcdn.daserste.de  which resolves to different cnames/addresses. Some of them seem to belong to broken servers, hence the TLS errors.
This explains why the error does not occur every time.

Example lookup when the error occur:

> 23:46:59.739357 IP6 xxxx:xxxx:xxxx:xxxx:d0ae:b41c:f33a:637e.34822 > xxxx:xxxx:xxxx:xxxx:3a10:d5ff:fedb:5270.53: 6500+ AAAA? mcdn.daserste.de. (34)
> 23:46:59.741323 IP6 xxxx:xxxx:xxxx:xxxx:d0ae:b41c:f33a:637e.56492 > xxxx:xxxx:xxxx:xxxx:3a10:d5ff:fedb:5270.53: 24039+ A? mcdn.daserste.de. (34)
> 23:46:59.773943 IP6 xxxx:xxxx:xxxx:xxxx:3a10:d5ff:fedb:5270.53 > xxxx:xxxx:xxxx:xxxx:d0ae:b41c:f33a:637e.34822: 6500 10/0/0 CNAME daserste-stream.trafficmanager.net., CNAME d1c8yplgk4rb21.cloudfront.net., AAAA 2600:9000:2250:8800:d:5701:2e40:93a1, AAAA 2600:9000:2250:3400:d:5701:2e40:93a1, AAAA 2600:9000:2250:a00:d:5701:2e40:93a1, AAAA 2600:9000:2250:a000:d:5701:2e40:93a1, AAAA 2600:9000:2250:2200:d:5701:2e40:93a1, AAAA 2600:9000:2250:f000:d:5701:2e40:93a1, AAAA 2600:9000:2250:800:d:5701:2e40:93a1, AAAA 2600:9000:2250:ba00:d:5701:2e40:93a1 (346)
> 23:46:59.775404 IP6 xxxx:xxxx:xxxx:xxxx:3a10:d5ff:fedb:5270.53 > xxxx:xxxx:xxxx:xxxx:d0ae:b41c:f33a:637e.56492: 24039 3/0/0 CNAME daserste-stream.trafficmanager.net., CNAME cl-gle53f4928.gcdn.co., A 217.195.193.62 (133)
> 


Looking in the dev console of Firefox when viewing the live stream at https://www.ardmediathek.de/live shows that instead of **mcdn.daserste.de** the domain **daserste-live.ard-mcdn.de** is used.

So maybe changing this address in Zapp will fix this issue.

**Comment by DaleBCooper** [comment]
Was able to reproduce it with mpv, MediathekView  and curl:

> $ mpv https://mcdn.daserste.de/daserste/de/master.m3u8
> [ffmpeg] tls: A TLS fatal alert has been received.
> Failed to open https://mcdn.daserste.de/daserste/de/master.m3u8.
> [ytdl_hook] ERROR: SSLV3_ALERT_HANDSHAKE_FAILURE: Try using --legacy-server-connect 
> [ytdl_hook] youtube-dl failed: unexpected error occurred 

> $ curl https://mcdn.daserste.de/daserste/de/master.m3u8 -vk
> *   Trying [2600:9000:223d:7400:d:5701:2e40:93a1]:443...
> * Connected to mcdn.daserste.de (2600:9000:223d:7400:d:5701:2e40:93a1) port 443 (#0)
> * ALPN: offers h2,http/1.1
> * TLSv1.3 (OUT), TLS handshake, Client hello (1):
> * TLSv1.3 (IN), TLS alert, handshake failure (552):
> * OpenSSL/3.0.15: error:0A000410:SSL routines::sslv3 alert handshake failure
> * Closing connection 0

Could not reproduce the problem with this URL:

https://daserste-live.ard-mcdn.de/daserste/live/hls/de/master.m3u8

I will submit a pull request.
